{
  "id": "id in dolor sint nisi",
  "appliedAmount": 16945032,
  "externalCreatedDate": "1991-01-19",
  "paymentAllocationName": "enim adipisicing consectetur nostrud labore",
  "relatedPaymentAllocation": [
    "ad cillum est quis"
  ],
  "name": "dolore",
  "auditInfo": {
    "isDeleted": null,
    "createdBy": "ut dolor",
    "updatedBy": "nostrud Duis",
    "updatedDate": "1984-11-29T01:28:37.163Z",
    "createdDate": "1950-10-02T17:38:21.368Z"
  }
}
